{
  "schema_version": "1.0",
  "policy_version": "2026-06-30-nbev11-default-activation",
  "active_default_reference_id": "nbenthamiana_nbev11_hc_v2",
  "activation_principles": [
    "reference file presence != product activation",
    "research comparator != public default",
    "disabled UI != backend permission",
    "manuscript framework != empirical validation claim"
  ],
  "references": [
    {
      "reference_id": "nbenthamiana_legacy_kazusa_sgn_v101",
      "tier": "historical_reproduction",
      "activation_status": "historical_only",
      "codon_table_path": "src/factorforge/data/nbenthamiana_codons.json",
      "checksum_sha256": "ddbd0a41da88109a709bca0304581e29bd0a756e4db1c51809d5002e9b2d5e8c",
      "source_name": "Kazusa CodonUsage Database + SGN genome v1.0.1",
      "source_url": "https://www.kazusa.or.jp/codon/",
      "source_doi_or_accession": "legacy_metadata_only",
      "source_version": "legacy_sgn_v101",
      "date_accessed_or_built": "2026-06-29",
      "organism": "Nicotiana benthamiana",
      "ncbi_taxid": 4100,
      "strain_or_cultivar": "legacy packaged reference; exact build path incomplete",
      "tissue_or_sample_scope": "not specified in packaged legacy metadata",
      "sequence_scope": "CDS",
      "isoform_policy": "unknown legacy packaging policy",
      "extraction_method": "legacy packaged codon table; authoritative build path incomplete",
      "normalization_method": "legacy packaged frequency table",
      "manual_curation": false,
      "license_or_redistribution_status": "legacy metadata only; redistribution status not fully reconstructed",
      "known_limitations": [
        "Authoritative build script and exact source extraction command are incomplete.",
        "Retained as a historical v3.2.x comparator after NbeV1.1 HC activation; this is not a biological inferiority or superiority claim."
      ],
      "intended_use": [
        "Historical continuity comparator for v3.2.x result interpretation.",
        "Sensitivity/reference-provenance analysis where legacy behavior must be reproduced."
      ],
      "not_for": [
        "Current N. benthamiana production default after NbeV1.1 HC activation.",
        "Experimental validation or performance evidence.",
        "Claiming comparative biological performance relative to other reference tables."
      ],
      "claim_boundary": "Configured in-silico codon reference only; not experimental validation or biological-performance evidence.",
      "public_exposure": {
        "python_library": "historical comparator/replay path only, not the current default",
        "cli": "historical comparator metadata only unless an explicit replay/import path is enabled",
        "rest_api": "not accepted as an override through public optimize paths",
        "web_ui": "hidden from public product selection; not selectable",
        "mcp": "may be reported as current baseline metadata only if surfaced",
        "docs_examples": "may be described as historical comparator with claim boundary",
        "manuscript": "historical software baseline/comparator only; not a validated biological optimum"
      },
      "activation_evidence": {
        "validation_dataset": "v3.2.8 rollback/stable legacy-reference baseline retained for historical replay",
        "analysis_plan": "not applicable to legacy baseline restoration",
        "reviewer_signoff": "Job 172 revert and Job 176/177 policy gates"
      },
      "notes": "Retained as historical comparator after NbeV1.1 HC activation."
    },
    {
      "reference_id": "nbenthamiana_nbev11_hc_v2",
      "tier": "production_enabled",
      "activation_status": "enabled",
      "codon_table_path": "src/factorforge/data/profiles/nbev11_cds_hc_derived_codons.json",
      "checksum_sha256": "686f12f2881b00a45246670e6c73e10d2254854577c5323ceb19a9ee58ee87dd",
      "source_name": "NbeV1.1 LAB-strain genome high-confidence CDS subset",
      "source_url": "https://nbenthamiana.jp/data/dl_data?data=transcripts_h",
      "source_doi_or_accession": "Kurotani et al. 2023, Plant and Cell Physiology 64(2):248; PMC9977260",
      "source_version": "Nbe_v1.1_cds_HC.fa.gz",
      "date_accessed_or_built": "2026-06-16",
      "organism": "Nicotiana benthamiana",
      "ncbi_taxid": 4100,
      "strain_or_cultivar": "NbeV1.1 laboratory-strain proxy; exact isolate identity not guaranteed",
      "tissue_or_sample_scope": "high-confidence CDS gene models",
      "sequence_scope": "CDS",
      "isoform_policy": "longest_isoform_per_gene_locus via scripts/build_codon_profile.py",
      "extraction_method": "strict_nuclear_cds_v1",
      "normalization_method": "Laplace pseudocount codon profile build",
      "manual_curation": false,
      "license_or_redistribution_status": "public genome/CDS resource; redistribution status should be reviewed before product activation",
      "known_limitations": [
        "Native AT-rich composition is not equivalent to expression-superior composition.",
        "Exact match to a specific wet-lab partner LAB isolate is not guaranteed.",
        "Activated as the current N. benthamiana software default with explicit claim boundaries; activation is not wet-lab validation."
      ],
      "intended_use": [
        "Current production-default codon reference for N. benthamiana profile-engine scoring and generation.",
        "Provenance-tracked genome-derived baseline for public software outputs."
      ],
      "not_for": [
        "Claims of experimental validation or comparative biological performance.",
        "Assuming exact identity to any specific partner LAB isolate."
      ],
      "claim_boundary": "Genome-derived in-silico software default only; not experimental validation or comparative biological-performance evidence.",
      "public_exposure": {
        "python_library": "current default through N. benthamiana production paths",
        "cli": "current default through N. benthamiana production paths",
        "rest_api": "current default through public optimize paths; overrides remain unsupported",
        "web_ui": "current default metadata; no reference selector introduced by this activation",
        "mcp": "may be reported as current default metadata only if surfaced",
        "docs_examples": "may be described as current configured genome-derived baseline with claim boundary",
        "manuscript": "current software default only; not a validated biological optimum"
      },
      "activation_evidence": {
        "validation_dataset": "NbeV1.1 high-confidence CDS-derived codon-profile build with checksum-pinned manifest",
        "analysis_plan": "activation aligned across runtime default, GC band, API/UI metadata, tests, docs, and manuscript wording",
        "reviewer_signoff": "user-approved B-path activation on 2026-06-30"
      },
      "notes": "Activated as current N. benthamiana production default; public overrides remain unsupported."
    },
    {
      "reference_id": "nbenthamiana_nbev11_all_cds_v2",
      "tier": "research_comparator",
      "activation_status": "research_only",
      "codon_table_path": "src/factorforge/data/profiles/nbev11_cds_all_derived_codons.json",
      "checksum_sha256": "0f2e48983a07ed501a0ddfb4ebfbb4b862b49d917221721014fc2d90509d86b8",
      "source_name": "NbeV1.1 LAB-strain genome all-CDS set",
      "source_url": "https://solgenomics.net/ftp/genomes/Nicotiana_benthamiana_NbeV1.1/Nbe_v1.1_cds.fa.gz",
      "source_doi_or_accession": "Kurotani et al. 2023 / Sol Genomics Network NbeV1.1 CDS",
      "source_version": "Nbe_v1.1_cds.fa.gz",
      "date_accessed_or_built": "2026-06-16",
      "organism": "Nicotiana benthamiana",
      "ncbi_taxid": 4100,
      "strain_or_cultivar": "NbeV1.1 laboratory-strain proxy",
      "tissue_or_sample_scope": "all CDS gene models",
      "sequence_scope": "CDS",
      "isoform_policy": "longest_isoform_per_gene_locus via scripts/build_codon_profile.py",
      "extraction_method": "strict_nuclear_cds_v1",
      "normalization_method": "Laplace pseudocount codon profile build",
      "manual_curation": false,
      "license_or_redistribution_status": "public genome/CDS resource; redistribution status should be reviewed before any public product activation",
      "known_limitations": [
        "All-CDS set includes lower-confidence annotations relative to the high-confidence subset.",
        "Intended as sensitivity/comparator evidence, not a recommended default."
      ],
      "intended_use": [
        "Research comparator for HC-vs-all sensitivity checks."
      ],
      "not_for": [
        "Production default or public selector without separate activation gate.",
        "Claims of biological superiority."
      ],
      "claim_boundary": "Research comparator only; not a validated or recommended production reference.",
      "public_exposure": {
        "python_library": "research/internal path only",
        "cli": "not listed as public production option",
        "rest_api": "not accepted through public optimize paths",
        "web_ui": "hidden from public product selection; not selectable",
        "mcp": "not selectable as production reference",
        "docs_examples": "research comparator framework only",
        "manuscript": "comparator/sensitivity framework only"
      },
      "activation_evidence": {
        "validation_dataset": "not applicable until activation proposed",
        "analysis_plan": "pending if activation proposed",
        "reviewer_signoff": "not approved for production activation"
      },
      "notes": "Near-HC comparator for annotation-quality sensitivity, not a product option."
    },
    {
      "reference_id": "nbenthamiana_qld183_v103",
      "tier": "research_comparator",
      "activation_status": "research_only",
      "codon_table_path": "src/factorforge/data/profiles/qld183_v103_derived_codons.json",
      "checksum_sha256": "191a90aa9efa8e3dc9d02c4f5c00c02c16388248aecd463888bcdb1f0562c7ed",